title,body,subreddit
I Just had a dream with Natalie Portman in it. Anybody want to hear / analyze?,"I (male) found myself in a cabin with several other people I know, and several female celebrities. The other female celebrities were being very sexual and flirty but Natalie wasn't. She asked if there was any take out nearby and I immediately jumped up from a lap dance to inform her I didn't think so, but I'd check. I ran outside and looked in all directions even running up streets in the 2 or 3 day old snow. I came back and everyone was preparing to go. I wasn't confident we'd find a place. 

We all sat in a multi car golf cart similar to a theme park tram and headed off. Passing a shopping center that I somehow hadn't seen we turn in to a massive food court. Instead of the large box stores there are individual food court style restaurants. I, of course, am wondering how Natalie is doing. She seems okay, cross-legged and somber. We turn into a mexican-themed ""store"" and, still driving, are able to read a large menu and follow paths to different departments. We arrive in one of the fancier sections were all they serve is bananas, rock salt, and assorted sauces. It's packed and in a frenzy of waiters emphatically suggesting dishes and cleaning about. Natalie seems satisfied but I have no further conversation with her. The last thing I remember was coming to a table that hadn't been cleaned yet. The only thing left to clear was a scattering of chalky rock salt. I took it upon myself to sweep it off and was carefully catching it when a male Latino waiter approached saying ""No, no (sweeping to the carpeted floor with a flat scraper) this is what we do."" I looked at him, somewhat handsome if I must describe. He said, ""This is how we clean. It is to sanitize the floor."" I looked again at him and said ""Genius"". &lt;/Dream&gt;

We dined in I imagine. 

I'm not gay and definitely attracted to Natalie Portman (asleep and awake). but I Found this dream to be very enjoyable and vivid. Welcoming all variety of interpretations. I'm going back to sleep.",AskReddit
"What technologies do you use on a daily basis, Reddit?","Looking for honest feedback on this, looking for more input for my ""Communication Technologies"" class, so I figured why not use a form of tech to do the interviews.

INTERVIEW three people you know who work in a business setting with technology. Ask them what technologies they use on a daily basis. Ask them what hardware (besides the computer) they work with.

Thanks in advance, Reddit! Looking forward to your answers/input!",AskReddit
what stand-up comedians have you seen live?,"ones that most of us have heard of. 



(sidenote- is it just me or are hipsters turning to stand-up comedy now? it seems like I can't turn on comedy central without seeing some cool hipster talking about how nerdy he is)",AskReddit
"Hey reddit, who do I talk to about getting someone banned for offensive behavior?",I don't want to get into details. I just want to know how to have a sexy conversation with the inappropriate admin.,AskReddit
Is Now the Time to Revive the Tucker Brand?,"For the uninitiated, here's the wikipedia article on the 1948 Tucker Sedan: ",AskReddit
What are your favourite munchies when you are high?,me and my buddy eat way too much McDonald's when we're high. Is there anything out there better or healthier? Throw em at me :D,AskReddit
Can I use WD-40 on my digital camera?,"My point and shoot Canon SD630's zoom lever gets stuck and won't go back to 'center'. Is it okay to use WD-40 to loosen it up? 

And are there any good tips using WD-40 on electronics",AskReddit
"Hey Reddit, my friend has a soapy Dilemma..","...so she's selling soap on etsy that's felted inside wool. The idea is that the wool keeps the soap together, and acts as a kind of flannel. The intial idea was to call it Yeti Soap, but a business advisor has told her this is a bad name, and so she's come up with Woolly Washers as an alternative. I think the advisor is wrong, but I was wondering what you guys think? Thanks!

Two logo's linked below;

Woolly Washers]( and [Yeti Soap",AskReddit
"Hey Reddit, I am getting married in four months and my fiance is asking me to compile a list of possible wedding songs to play, specifically for our  first dance .... Any suggestions?","OK, so... We are meeting with the DJ in about two weeks, and I am looking for possible songs to play. We don't want the traditional and lame songs played. There will be no 'chicken dance' or 'Cotton-Eyed Joe'. Nothing lame like that. 

Most importantly, is the first dance song. We want to do something more modern, maybe rock or acoustic rock. Our first concert was the Foo Fighters, so I listened to alot of their stuff, but couldn't find anything that would work for the ""First Dance"".

I've already decided that my dance with my mom will be to the cover of Simple Man, by Shinedown. Hopefully, this will  point you in the right direction. 

I am open to pretty much anything, as long as it won't piss off our grandparents. Any suggestions you may, will make my life ALOT easier. Thanks in advance!",AskReddit
Is there a theoretical maximum size of objects?,"I was just curious if there was theoretical maximum size of rock planets, gas giants, or suns? Is there a maximum weight or size that above it would collapse in upon itself? Or do something else?",AskReddit
"Dear Reddit, I need to get revenge on a crooked contractor. Tell me what I should do (and don't hold back)","We had some guys come in and do some work on the kitchen. They butchered the job, I fired them, and now they are threatening me. I think I've gotten them off my case, but now I need to get back at them. Note: I don't want to go to jail for this, but I do want them to pay. Thanks in advance for you suggestions.",AskReddit
"Dear reddit, what are your thoughts on black history month?","***Well first off if you get the idea I am a bigot that is not my intention***

Okay well I've felt this way for a long time, and I have to agree with the thoughts of Morgan Freeman. Why do we have a month for just black people to honor, why must we view their accomplishments based on their color. I get it there is still a glass ceiling out there that is constantly making these accomplishments even harder for minorities. I know back during 2008 where presidential candidates were sorting themselves out, kids at my high school were like ""yeah I think its time we had a black president"". Why does it matter what race he is I mean the guy and his wife are incredibly smart and successful people. ""Oh wow we have such a smart president, AND HES BLACK"". Not just that but why don't we have an Asian history month, a Hispanic history month?  Do we view black people as idiots and lesser beings that anything they can accomplish is breaking news? So why don't we just celebrate everyone, all year around.

What are your thoughts reddit? maybe I'm just being a paranoid idiot, so tell me what you think.",AskReddit
Is there any way to get out from under a HOA?,"In short my HOA sucks hard.
Ive been living in my town house that for 6 years. The HOA fee started at $145 and is now up to $190. They raise the fee each year.
Which wouldn't grind my gears but...
They don't even open the pool anymore because they cant afford it.
The tennis court and basketball court are long over grown with vegetation and not even close to being usable.
I have like a 1ft by 3ft piece of grass which i guess they maintain and besides putting away money for other things, i feel like im paying them $190 a month to mow that patch.
The community looks like crap. They aren't keeping up with maintenance on peoples houses.
Now they want an extra $300 this year from everyone because they town raised the water rates.
I think paying these guys about $2000 a year to do nothing is a bit much.
Yes, i know they probably reroof the house at some point. But the way they do things, when they have to do that, they are going to say they dont have the money and are going to ask for more money.

Plus, it seems to me, they keep raising the damn HOA fee, then more people dont pay it because they cant afford it, so they raise the HOA fee again to cover the people who don't pay it.. and then circle continues.
And who the hell would move into somewhere where the HOA fee is $190?  Nobody. SO, to cover the costs of those empty units, guess what they do? Raise the HOA fee.

The only thing these guys have done for me is send me threatening letters because my neighbors dog shit on my lawn and I didnt clean it up (isnt that what im paying them for?).  ANd when i convinced them that it wasnt my dog and i wasn't going to clean it up, I then asked them if my next 'violation' would be my first or second. They said second. ANd I asked how since the first one wasn't even my dog. They didn't have an answer to that but stuck with, if i get another letter, it will be my second warning (and therefore a higher penalty fee.)

And before anyone asks. I would love to GTFO but my house is too far under for me to move.",AskReddit
"Reddit, I'm deployed to Iraq and need a call sign.  Any suggestions?","I'm an Air Force communicator, so apparently I need this call sign in case we start carrying radios.  I can't think of anything funny, so I thought I would turn to reddit for help.

EDIT:  I went with Man-Raptor.  Thanks cyberwiz01!!!",AskReddit
"Dear Reddit, my PC is slowly dying and id like to know...","whats the best bare bones set up i can buy around 400-500 dollars?
my hard drives are new, power supply, burners, etc. all work. its just the mobo and vid card that's dying. so id need a case, mobo, and vid card that would be tops for gaming, and running photoshop and illustrator. (im a graphic designer)so my budget is modest. 

i have googled this to no end but im still unsure what to get. 

i have seen this Dell XPS! which is along the lines of what i need.

edit:excuse this post if its formatted incorrectly i have scanlines all over my screen and i can barely read text. 

ps. i have trouble shot drivers all evening, its hardware fo sho.",AskReddit
What is a good source of a Vitamin B6/B12 boost?,"When I have to be alert or I worked out too hard and I'm feeling beaten, I like to drink a glass of generic Emergen-C because of the +1000% shot of vitamin B it gives you. Makes me feel pretty good. 

Only problem is I think it tastes like monkey butt and I find the fizzing to be overrated. As for those 5-Hour Energy things, I think they're way overpriced. And vitamin B complex pills have a much smaller dosage.

Any cheap sources of Vit B out there?",AskReddit
"Should my kid get baptized, even if I think its kinda nutty?","Dear Reddit - here's the question:  I have been married for several years.  I am not religious.  My wife was raised in a very conservative Catholic family.  She's not active, but she's on the fence re: her beliefs.  To please her parents (whom I really like and respect) she asked if we could get our latest progeny (kid v2.0) baptized.  My first reaction was:  Fuck That.  However, as time goes by (a few weeks) I'm softening my stance and thinking ""what's the harm if they splash some water on the kid's head and chant and dance 'round him for a minute?""  It would please my in-laws beyond words and therefore please my wife...  Thoughts?",AskReddit
Why does reddit keep locking up Firefox 3.6?,"It seems like ever since I upgraded to Firefox 3.6, opening any reddit page generally causes it to lock completely for up to 5-10 seconds. It's become very annoying, and I'm just wondering if anyone else has had this issue.",AskReddit
Guy wants to do something sweet for his lady on Valentine's day. Suggestions pls :),"Hi all,

I know for some V-day can be a downer. So if it is for you, I apologize in advance. But this is not what I want to discuss... so please refrain from slamming the said day and please only post if you can contribute to my actual question.

I have been with the same lady for just about 4 years now. Every V-day, I've tried to do something thoughtful for my lady that is within my means. Now, Im not rich or anything but I try to be different without being too over the top. I've done the dozen roses at work, nice dinners and last year I surprised her with a new kitty. 

This year I have a lot in the way of finances to consider and so the budget isn't very high... I would love to definitely stay well under the $100 mark (going on vacation for the first time in 3 years at the end of the month!). Anyway, I would love to hear suggestions on what to do this year or even some of your past experiences. I always strive to do something that she wouldnt expect, something different that makes her feel like the only woman in the world. You know, like a princess. Help me knock her off her feet this year! 

*Note: We have had a slightly rough patch a few days ago that were trying to get through and doing this right would really be great step in the right direction to forgetting our little tiff.

Thanks for taking the time to read this and helping me out.

Cheers,",AskReddit
Has anyone taken a solo vacation? Where did you go?,"In about a month, I'll be going on a week-long solo road trip to Minneapolis, probably Detroit, and then Pittsburgh. I'll be seeing people along the way, but at the end of the day it is a solo road trip. None of my friends wanted to go and do what I want to do, so I'm doing it myself.

I'll be spending 5 days in Pittsburgh, going to 2 Penguins games, and hopefully meeting up with someone there at some point, but I'm trying to figure out how to spend my time there. I'll have to find a gym to go to for a few days (triathlon training) and I'll have plenty of books along and my laptop for writing. Otherwise, I plan on visiting museums and restaurants and doing a lot of tooling around.

Who else has done this? What did you do with all of your time?",AskReddit
What do you guys think of eating raw cereal - as in without milk?,"I just tried eating some cereal with black coffee and actually liked it. The coffee at work isn't that good, so I usually can't drink it without the creamer, but I am liking raw cereal with coffee.",AskReddit
Can someone give me a cheaper alternative to satellite internet?,"I live out in the middle of nowhere. I am forced to use and iphone for internet and that is amazingly slow because I don't receive 3G or a consistent EDGE signal. I was looking at this product I found on google called Proxicast but I'm looking for 3G speeds. Austin ( approx. 50 miles) has 3G and I believe Killeen (approx. 30 miles does) does too. My main question is would this be a sufficient solution if I added an antenna or something similar? I figure it would be cheaper to purchase internet access from a cell phone company than satellite. 
If anyone has any other suggestions please suggest away.
Thanks
edit:god almighty, the price for the equipment is insane.",AskReddit
What would you ask when considering buying a restaurant?,"I've always wanted to own a pizza place ever since I managed two of them in highschool/college. I have a completely unrelated job now, but there is a very small chance that some big things may fall into place and I could end up owning one. It's like two blocks from my house and if I could get it for the right price there's a pretty good chance of success.

I'm meeting with the current owner today and besides the normal operating costs and expenses just curious if Reddit had any advice on what other questions might be worthwhile to know.",AskReddit
Redditors in NYC: I need your assistance.  More inside.,"I am currently training for the NYC Half Marathon in March 21 with the Leukemia and Lymphoma Society's Team In Training.  I'm doing it for personal reasons (friend whose 19yo cousin passed away in November after a long struggle with Lymphoma, a best friend whose mom got diagnosed a month ago with B-Cell Lymphoma, etc).  I need to raise $1,800 for LLS and I'm currently at slightly under $500.

One of my teammates and I are looking for a bar in NYC that can host a fundraiser event for us to help us out.  We've already organized one for Feb. 11th but we need to set up some more to make sure we hit our goal.  I'm sure there's gotta be at least one redditor that owns a bar in NYC.  Please reddit, you're my only hope! TIA.

Ask me any questions, I'll be glad to answer.  Here's my official TNT page: ",AskReddit
My brother is starting an online reselling business. What do I need to know?,"I'm being tasked with making the site, which is going to require a lot of research, but that's not the focus. What do you have to do to have a legit business? What's recommended? What's legal? Which is the best online shopping cart system to use? Any advice, Reddit?",AskReddit
Must homework be abolished?,"I would like to know how every child and adult (mainly chidren) feel about homework and what exactly they mean by the task: whether it's challenging and worth pondering upon or just copying and pasting from the internet or any other source. Frankly and sadly, the second scenario's usually the case at our school. I am quite smart and due to the way they give homework at our school, I see no encouragement in doing my homework. I want to know about other ones and how they are better/worse for smart/below-average children.",AskReddit
Foreign Language Course Study Tips?,"I'm taking a foreign language course in college, and I find it a bit of a struggle to keep current. I put in a lot of time, but have real trouble committing the vocabulary to memory. Flash cards just don't seem to get the job done.

Are there any tips or tricks you've used to make this a bit easier? It's a relatively uncommon language (Persian), so I don't have some of the options that I would with something like Spanish or French.

I read through this post, but that's geared toward self-study where you have a little more latitude in how you study and at what pace.",AskReddit
What obscure performer do you find sexy?,"If you think Angelina Jolie or Megan Fox is hot, yeah, well, so do a ton of other people.

Who do you find really attractive that's a little more on the obscure side?

Back in the day when I'd watch Wings I thought Farrah Forke, who played Alex Lambert, was very hot.  I can't find any pictures of her that do her justice though.",AskReddit
Is there anywhere that teaches being a survivalist as part of a high school curriculum? Or is that mainly a scouting thing?,"Fixed

Wouldn't it be a good idea that instead of taking gym for a year students could opt to learn how to camp, fish, trap, hunt and gather things that would aid in personal suvival? I see this as better information than playing rollerhockey and I like rollerhockey.",AskReddit
"Hey Reddit, the copy machine near my computer makes a really loud banging noise? Whats a funny sign I could hang on it to explain the noise?","When the copy machine warms up it makes three or four loud bangs. Its a crappy machine thats always breaking down. I thought of putting a sign that says ""Disregard noise. Alarm used to awaken the deaf dwarf typist inside"". Whats something funnier that I would be able to put up there? Thanks",AskReddit
"Reddit, help me figure out the most efficient way to shovel my oddly-shaped driveway!","So, we got a whole bunch of snow last night and it kind of sucks to shovel it. I have an oddly-shaped driveway and shoveling it can be a difficult endeavor. 
Here is an approximation of how the driveway looks. 
Here it is with a grid for easier description.

I frequently shovel from C1 to C4 (down the middle) and then go outwards from there, but when we get a lot of snow (a foot or so, like this morning) that can involve a lot of snow-throwing which is murder on my back.

So, do you guys have any ideas? I only have a manual shovel--a snowblower would be too expensive. Keep in mind that if I push the snow too far, it leaks over the side of the shovel and leaves lines of snow on either side where I'm pushing. 

The winner gets a no-expenses-paid trip to Wisconsin to implement his/her plan!",AskReddit
Why are so many people upset that the President nixed another manned mission to the moon? If we went there multiple times 40 years ago... Why go back?,"I mean, if theres basically nothing up there but dust and rocks, what do we Need to go back for? 

And why the hell did we spend so much on a Space Station if we are going to nix the space shuttles that can get us there?",AskReddit
"Ok Reddit, I need your help, pllease let me know if you can help...",Does anybody know if there's a website where you can enter a cell phone number and find out who's it is? I keep getting phone calls from a number and don't know who it's from. I know it's a cell phone number and when I try to call back no one answers and a voicemail picks up but doesn't say who's phone it is. You're help would be greatly appreciated. I don't want to be missing a call from someone important. Thank you!!! :),AskReddit
What's the best status that you've seen on facebook?,"You know you're ugly when you have a car as a profile picture. No, you are NOT a ferrari.",AskReddit
What's the best thing you've said while asleep?,"I've had my share of funny sleep-conversations with waking people:

Me: ""It's rhetorical.""

My dad: ""What's rhetorical?""

Me: ""It's rhetorical!""

or

Me: ""We have good connection in here.""

My roommate: ""What connection?""

Me: ""Radio.""


But last night takes the cake.  My roommate was watching Comedy Central so late that I had been asleep for hours and the Girls Gone Wild ads were on.

GGW announcer: ""... hot and 18, just like you like 'em.""

Me: ""Oh, yea.""


How about you, reddit?",AskReddit
I have a question for the guys...,"My boyfriend and I have a great relationship but the sex could be better! It's good but the problem is that he is quick to the finish. I sometimes just take care of myself before without him knowing so he thinks I was able to orgasm in those few seconds of ecstasy! 
I need tips and advice to help him and give him to make things last a bit longer! Help!",AskReddit
"Reddit, what's the best office prank you've pulled off?","My favorite was hiding a 'CK One' scented air freshener under a coworkers desk. For weeks he went on and on asking everyone if they were wearing cologne or perfume (he was the only person not in on it). We all said we couldn't smell it, even though we could, it was just really strong at his desk. Finally after a few weeks the scent faded ... SO I REPLACED IT! Oh man, it was so awesome. He was furious, just made it all better. No one ever told him.

 My second favorite was carefully removing the bottom of a Coke can (by holding it against a belt sander), then filling it with Airsoft pellets and putting it on someone's desk right side up ... Haha, what a mess.",AskReddit
"Reddit, could you fully explain the process of moving to a different country overseas?","My girlfriend and I eventually want to move to a different country in the future, probably New Zealand.

Has anyone done this? Could you detail the steps you took?",AskReddit
"Hey Reddit, I'm thinking about studying abroad next semester (preferably somewhere in Europe). Any suggestions for locations/schools?","I'm currently in my Junior year at the University of Massachusetts, studying Physics. I'm considering taking the first semester of my Senior year in a European country. I speak no foreign languages, and have little ability to learn them in classes (at least that's how it was in High School), so ideally a country in which English was at least possible. I think it would be great to immerse myself in a foreign language country, but I also don't want to waste a semester trying to learn the language and doing poorly in classes because of it. 

I'm fully prepared for the culture shock (in fact, this is one of the main reasons why I'm considering it). Any suggestions for Countries, schools, etc.? Any particular places where you suggest not to go? Thanks for any help.",AskReddit
"Hi Reddit! It's my birthday, what should I do?","I'm at RRC in Winnipeg right now for another 4 hours. Afterwards I have 8 hours to kill on my 24th bday. I'm thinking to go to Avatar in IMAX, but lets hear other suggestions. Thanks in advance!",AskReddit
What's your internal monologue like?,"For me, it went like this just a few moments ago:

  * I'm going to have some caffeine now.  That should keep me going until shortly after I get home, whereupon I'll take a nap.
    * Upvoted for 'whereupon'
      * Did I just upvote my own thoughts?",AskReddit
Why are guys naturally good at fighting?,"In high school I had my first group of friends that contained boys. Occasionally they would get in play fights with each other.  By that I mean no major injuries. It wasn't fight club or anything, just playful scuffles. I tried to join in one day but ended up just bruising my knuckles because I had no idea how to fight properly. I felt left out, so I joined a dojang. It took me a year of training to be able to beat one of them in a fight. I don't think anyone else had formal training.

Are boys better fighters naturally? At the dojang the girls and boys of the same belt level were equally skilled. But without proper training boys seem better.",AskReddit
"What do you do you protect your computer? (virus scanners, firewalls, proxies, settings, etc)","I want to hear about your particular strategy for computer security. This isn't so much an advice or ""please help"" post, I'm just curious about how others do it.

Also, lets hear about some common mistakes, or common loopholes left by choosing the default security options, windows firewall, etc.

Please, refrain from smug uber-user comments like ""oh I use linux I don't have any computer security issues.""",AskReddit
