title,body,subreddit
Thought you might be able to drop some insight on me.,"I am a huge music fan, i really am open to anything under the sun. But if i am being totally honest my hands down favorite bands are Phish, String Cheese Incident, and so forth and so on.

I was just trying to get some insight as to why (generally speaking) people don't give bands/music of this type a fair shake.",AskReddit
Had a couple questions about diet,I am trying to cut down on the chub I've gained. The chub mostly accumulated in my lower stomach. My friend recommended that I do a fruit diet and lots of cardio. Are there better ways to help the chub go away? I don't want to do anything as extreme as the master cleanse.,AskReddit
Why didn't TSA stop me for a lighter?,I'm flying out of Atlanta. I'm sitting in the smoking bar and just realized I have a lighter in my purse. Why didn't they confiscate that?  Is it ok now?  I've thrown a lot of lighters away needlessly I guess.,AskReddit
Why don't more text based websites consist primarily of darker backgrounds with light fonts?,"It may seem like a silly question but given that most of us Westerners spend a significant amount of our days staring at glowing rectangles, it would be much more comfortable on the eyes and seem less mentally fatiguing in the long run.  My email is set this way and I wish I had done this a long time ago...",AskReddit
Dear Reddit: what Celebrity do you look like? or have been told you looked like?,"Add Pics :)

with a beanie.. 
Collin Ferrel
but mostly Adam Lambert.. im not happy about it.. the dude is good looking but having people telling you, you look like some dude who likes other dudes doesnt fly. offcourse, they say the straight version but anyway. Who do you look like?
this is me  
this is adam... dammit ",AskReddit
"Does anyone else subscribe to the ""Trickle down theory"" of personal hygiene?","Now lemme preface: I dont do this EVERY time I shower, but probably 3/5 times.  So heres the practice: Instead of wasting an extra 2-3 minutes scrubbing my body with a bar of soap, I simply let the soap from my shampooed hair ""trickle down"".  I then use the trickle down as a soap substitute.  

Edit: I had no idea redditors were so cleanly.",AskReddit
"I will be in Lima, Ohio Monday night/tuesday on business.  What is there to do, and see in the area?","Ill be there for a Federal Railroad Administration class on Tuesday; I will be arriving Monday night around 6pm and staying at the Holiday Inn (I am guessing it is ghetto, since the company tends to find the cheapest rooms).

What is there to see and do that is cheap?  Just need to entertain myself monday night and I have no clue what is down there.",AskReddit
"In twelve hours, I'm going to start a two-week substitute teaching gig at the local jail.  Computer literacy is my subject.  Any advice?","I'll be teaching two men's classes in the morning and afternoon.  On Monday evenings, I'll also be teaching the women.  I've observed all of the classes with their normal teacher.  The students are some tough mofo's, but they were respectful and engaged for the most part.  I'm still a bit apprehensive as I've only taught ESL up to this point.  Does anyone have experience teaching in jails or prisons?  Do you work in a jail? Have you been a prisoner who's had a good teacher while you were locked up?  Any advice would be great.",AskReddit
"Reddit, what the hell is wrong with me?","I'm a caucasian american guy and I just can't be satisfied in a relationship unless I'm dating an asian woman. I've had two significant relationships with asian girls and since the last one ended (last year) I'm just not as attracted to american women anymore. I'm currently seeing an american girl and we have a lot in common, she is a blast to hang out with but I still can't stop thinking about asian girls and how much I'd rather be with one. I'm worried I won't be satisfied until I meet another asian girl. What should I do reddit?

EDIT: I should add that there aren't many asian women in my city. the two girls i dated before were here as exchange students and I was just lucky to have met them while I was out one night.",AskReddit
Is the internet speed in the US really that bad?,"I've been seeing a lot of articles about how X country's internet is Y times faster than the internet in the United States or X country proposed new internet legislation that will make their nationwide internet Y times faster than the internet in the U.S.

But really, is the internet in the U.S. that bad? I mean, I have Comcast. I just ran a speedtest and got a ping of 53ms, downspeed of 23.03Mb/s, and upspeed of 3.00Mb/s. Admittedly, it's a good day for internet speed, but I rarely get below 12Mb/s downspeed. I don't download media illegally. I enjoy Hulu and Youtube. I play MMORPG's and download Linux CD images. Sometimes I download or torrent games and updates legally, and it takes a little patience, but I don't mind. But for consumer internet, I have no complaints with my speed.

I don't know. I got first got the internet when I was in early grade school, back in the early 90's, before anyone else I knew got it. My ISP was IDT. THAT was slow internet. A WEBSITE with PICTURES? You'd be waiting a few minutes.

Is our internet really that bad? Do we really need faster internet? I hear a lot of complaints, but I don't see the need when there's so many better things we should invest in like health care or education.",AskReddit
"Dear Reddit, what is the nicest thing you have done for your parents recently?","Considering they raised us, fed us and gave us place to live for many years, it seems fitting that we try to give something back to them. What have you done recently for your parents? 


Personally, I'm still young and am still living at home (only for another few weeks until I move out for university), but ever since we've lived at this current house, our garden has been a shambles. Over the past couple of weeks I've put in many hours of labour to try to bring some order to the garden and to create the lawn we've always wanted.

I'm still not finished and have many hours of work still to do but I think it'll definitely be worth it.",AskReddit
"Dear, Reddit. What's your favorite cheese?","I worked at a grocery store deli growing up, and I sampled a few different kinds.  I keep coming back to the delightfully bitter taste of a good domestic swiss.  What about you?  I'm looking for something new to try.",AskReddit
"Dear Reddit, what are your hobbies?","I'm currently between school and work and sitting alone in my apartment while all my friends are at school playing video games is starting to get extremely repetitive and boring.

I've realized I need to pick up some hobbies to occupy my time. So, reddit, tell me what you do.",AskReddit
"Hey reddit, how big is your TV?","Mine is 37"" 720p. Bought about a year ago by my wife when I was deployed to Afghanistan. I had never had any thing bigger than a 19"" CRT, so at first this TV was awesome. Since she bought it we have moved to a larger house. The living room is pretty huge so our couch sits quite a bit away from the TV, which is makes it smaller. Anyway, I was thinking about getting a bigger one and wanted to know what the average is. 

How big is your TV?",AskReddit
"Reddit, what are some good fake/novely ID websites?",My friend and I are looking to buy fake/novelty fake id's and are wondering what some good websites are to buy from.,AskReddit
Anyone out there in the vast-ness of our world have any local sayings/words/phrases?,"Where I'm from we call soda, Coke. I hear in other parts they call it Drink, Soda, Pop, or even tonic. Oh yeah, EVERYONE here also calls this place a shithole.

I was wondering if there were anymore of these little phrases where you all are from.


*Edit*: Rephraseing",AskReddit
What's in your pockets right now Reddit?,"Here's mine

Edit: Thanks for posting pictures of your contents for those of you who did.  This was the general idea.",AskReddit
Collectors - What do you collect and why?,"Curious why we collect things. I have collected various things over the years. Currently I collect die-cast cars - mainly because I love cars, but the urge/need to have all of something seems to take over. I have several hundred of them (of all scales), but have run out of room to display them, so I have stopped.

So, what do you collect, why, for how long, and how do you keep track of it?",AskReddit
Does anyone know of any program that would allow me to download this book for school?,"We're using this book for my French translation class, and my teacher said we can just use the online version instead of buying the book, and it'd obviously be a little easier if I had it as a pdf or something.

I figure it's probably a long shot, though, but I may as well try.",AskReddit
"Alright, what are some awesome TV Series I've never seen?","I'm a pretty big nerd and get hard over sci-fi/science type shows. I also love a great comedy and usually get hooked on decent documentaries. I've only recently started watching TV again (after about a 5-6 year break, another story for another time) and it's time to catch up.

edit: I do not mind if the shows are no longer running since I'm Australian and we'll get them months/years after y'all do.",AskReddit
Would you rather drown to death or die of thirst?,"For whatever reason, you find yourself in a sticky situation where you have to choose between a quick but panic-filled drowning or a long, slow, painful death by thirst.  I think the logical choice is to choose drowning but I'm not sure I could bring myself to do it.",AskReddit
What movie really disturbed the hell out of you as an adult?,"This was inspired by this

Personally, it was Oldboy - wanted to cleanse myself in the fires of Hell after watching it. Yet I recommend it to all my friends.",AskReddit
Is it legal to take pictures of a minor in a school environment?,"That is, if they don't know what you're doing. And what if they do but don't approve?
Edit: No I dont want to do this, I'm just curious of the law. And yes, I'm a minor.",AskReddit
Is there a name for a conflicted erection?,"Like when you read a story about a female schoolteacher having an affair with a male student, or even worse/hotter situations where you have to be outwardly all *tsk tsk* but inwardly *fap fap*.

Inappropriate arousal?

Hard-on of shame?

Some of the IAMAs I read include stories of abuse where I know it's just wrong and I should be empathic or outraged, but sometimes it's hottt.  And then my boner is conflicted.",AskReddit
What is your greatest gameing achievement?,"Dont really care what it is. Weither it be beating sephoroth on kingdom hearts, Getting one of the two secret messages in god of war without knowing,, or even beating Half life 2 with a broken hand on a PC.",AskReddit
"Hey reddit, my buddy and I want to build a robot","My buddy and I want to build a robot for a school project, but we can't think of what we want it to do. So far we've come up with a sandwich maker, but we'd love to hear what Reddit has to say.",AskReddit
How should I approach my girlfriend about blowjobs?,"I feel really childish and selfish for asking this question, but the truth is that although I'm a 23 year old male who has been going out with my girlfriend since high-school began, I have yet to receive oral sex from her.

We have sex regularly and she enjoys it as much if not more than I do. We've crossed many barriers in our relationship and I have kept honesty first.

However, I can't seem to figure out how to approach her about getting a blowjob. I don't want her to think I'm selfish, and although conversations have began (of her own accord) regarding ""returning the favor"" those conversations end quickly and she forgets them.

It would help to mention that when she was little she was raped by a close family member, so she may be scared (or something) of blowjobs. She's alluded to this many times as being the reason but her responses aren't sufficient.

Am I being a jerk for wanting something in return? Should I just ignore it and move on, or should I approach her about it? How can I do it without seeming like a total dick?

EDIT: Thanks, reddit. I got the advice I think I needed.",AskReddit
Can Reddit give me nightmares?,"So here's the thing - I haven't been genuinely scared in years. Not for lack of trying, (I've read creepypasta, I have a bad diet, I've visited the ""spooky sites"") but I can't honestly remember a time where I've woken up from  a bad dream.

Keep in mind, here, I'm talking about an atmosphere of fear, rather than a body shock or some startling movement; I'm looking for fear that makes me worry about what's in the shadows in my room.

I don't mind being linked to videos, so long as they're hosted on youtube and aren't overly long (I have a download limit) and I don't mind text of any reasonable length: something below ten minutes of video or a short story's worth of words.

Do you think you can do it?",AskReddit
I found a job posting online for my current position. Any advice on how to handle this?,"A little background: In November I was hired into a non-management position at a salary about 5k less than I had been making at the job I got laid off from in September. The plan was for me to work with the current manager for 2 or 3 months after which she would leave the position to go back to school and I would be promoted to manager. I've actually got several years more experience than her so this seemed fine. I took the job. 

One day after I was hired she announced she would be leaving the company in 2 weeks. Instead of 3 months to train I had 2 weeks during the busiest time of the year for the company. The transition was a little rough but over the past month I've slowly been bringing some order to a system that was completely chaotic. Very few employees had been trained properly, equipment was all out of calibration, documents had errors in them, etc. 

I haven't been given any negative feedback on my job so far. In fact, on Friday they assigned 2 additional employees to work for me (so now I'm managing 9 people.) Furthermore we haven't had any major disasters that could be considered my fault. 

Today I discover a job posting advertising my exact title at my current company. It's a small company entering our slowest time of the year, business-wise and there's no room for two managers with my title. I conclude that they're going to try to replace me with someone with more experience who will work for the same non-competitive wage (20k under the industry average for the position.) 

The owner is kind of a prick and this is PRECISELY the kind of thing I would expect him to do. He finds excuses to fire pregnant women so he doesn't have to pay their health insurance during their leave. The company's main production location has so many OHSA violations that it would be a 6-figure fine if it ever got inspected. 

I can't decide if I should just flat-out ask the owner of the company why the position was posted or if I should just wait it out and see what they do.",AskReddit
I've got movie block...any suggestions?,"Dear fellow redditors, 
I'm bored witless and I'd like to watch a good flick tonight, but no clue what. 
Do you have a favorite movie or have you seen anything worth watching lately?

Add: Sweet, thanks for all the suggestions. Think I'm going to start with Pandorum.",AskReddit
What is the saddest song you have ever heard?,"Trying to create an apocalyptically depressing, be-all-end-all mix of sad songs - hit me with some suggestions.",AskReddit
What is the craziest fact you know that most people won't know?,"The word ""POSH""  stands for ""Port Out, Starboard Home"". It was printed on wealthy passengers tickets who wanted the most desirable cabins on the shady side of the cruise ship.",AskReddit
"Reddit, what are salaries like for HS Chemistry teachers?",I am a chemistry major thinking about education as a possible career. I am curious to know what salaries are like. (US-either NY or CA),AskReddit
"Reddit: Now that I am a certified college dropout, WHAT DO I DO?","So, halfway through my third year at school i get kicked out due to grades. I would be starting a new semester tomorrow, but instead i'm at my house wondering what the hell to do now. I don't think i could stand a customer service job. WHAT DO I DO?",AskReddit
"Reddit, how should I style my growing hair?","im in the process of growing it out, and it's gotten to the point where im unable to not style it without looking like a fool (kind of resembles a coconut helmet when its down). i usually do a fauxhawk, but its gotten too long for that already, too. im sure a lot of you redditors has grown your hair out, how did you style it?",AskReddit
"How big is your porn folder, Reddit?","Mine : 

It would probably be a few gigs larger if I downloaded the favorited videos from Spankwire, but I'm saving that for a very very rainy day.",AskReddit
"If you pointed a 150mw laser into a photo radar camera, would it disable it?",Let say you were 1000 meters away and pointed this hand held laser into a photo radar camera. Would it disable the camera? Permanently?,AskReddit
"Hey Reddit, what's the best decision you ever made?","I picked up ""Charlie and the Chocolate Factory"" and haven't stopped reading ever since.",AskReddit
Have you ever wondered if Obama's whole being a Christian thing is a big political charade?,"I mean most highly educated academics tend to be either agnostic or atheists, and he is one of them. If you read his books you'll learn that he only embraced Christianity through the United Church (the most liberal church) in his early thirties, before then he was an agnostic. I've always thought that the whole Christianity thing was a political move on his part. I certainly don't blame him, seeing that most americans would never vote for someone who describes himself as an atheist or an agnostic. But is something that has always been in my mind. Any thoughts?

Edit1: I know its not that much proof on my contention that most highly educated academics are either agnostic of atheist but this graph seems to back up my claim. (Thanks to thesteeeve for the link)
",AskReddit
I'm having pain during sex. Please help!,"Whenever anything is happening like even something little like a finger it hurts like poking a scab, best way to describe the pain.It has stopped me from doing stuff. It's been going on for at least 2 1/2 years and I'm scared to go to the doctor for fear of what it could be. Is this something normal when beginning to have sex and will pass or should I go to the doctor?

I thought it might be psychological at first, but it hasn't really died down even though I'm comfortable with my boyfriend.

Any ideas what could cause this?",AskReddit
i need help regarding torrents(details inside),"I'm running Snow Leopard, I am somewhat of a torrent newcomer. I wanted to download and use The Rosetta Stone. How do i make it work? All this talk about cracks and ISO(wtf does this mean?"" is making me dizzy. i was wondering if someone could explain how to do it in common speech step by step, any help would be appreciated.",AskReddit
"Reddit, can you help me identify this song?","I have no idea who the artist is.  All I know is that it sounded like an oldie from the 1950s or 60s.  The song's main riff used ""Westminster Quarters"" with a strong backbeat.  I've checked the Wikipedia entry on Westminster Quarters, but it's not any of the songs listed.

I know it's not much... but any ideas?

**EDIT: It took me almost a year but I finally figured out it was ""Ding Dong, Ding Dong"" by George Harrison.**",AskReddit
Can reddit help me to identify this condition?,"I have a friend whose father always needs to know my friend's current location. My friend will receive calls from his father every 2-3 hours. His father wouldn't allow him to go out (even to work) after 9 PM. His father will follow my friend to the workplace secretly sometimes. My friend works as a mechanic so he needs to go to his customers' place to repair something. Somehow his father just wants him to come back. His father is jobless and my friend is the breadwinner in the family. Can reddit help me to identify this condition and if possible suggest some approaches that my friend can take. 

EDIT : According to reddit, this is over-protective parent. So any suggestion for this condition? My friend is 23 years-old. 

Addendum : Seems like reddit thinks that my friend needs to have a good talk with his dad instead of letting it happen again and again. I will let my friend know what reddit suggests.",AskReddit
"What made you lose faith in humanity? If you still have some, why?","For me it was the lack of support I received when my dad passed away. Never have I seen so little sympathy seen from the people I cared about. And now I'm considered a weirdo because of depression and panic disorder, when mostly what I need is some support.",AskReddit
"Alright, someone has to have a better prank than this.","My friend is leaving her school and they have a study room, basically it's open to the opportunity for a well planned prank/defacing.

The best idea I really could come up with is that everyone cuts off their pubes and puts them into a bowl. Then get glue and draw a big veiny dick on the window and proceed to throw the hair all over it.",AskReddit
I'm thinking of having a minor in mathematics. What do you think?,"My major is business, I probably will minor in Accounting. However, I think it would be good for me to major in math. I've always been good at it, and I'm taking my first calculus class and I find it genuinely interesting. What do you think?",AskReddit
"Hey Reddit, I Just Got A New Puppy. What Should I Name Her?","The name has to be approved my my nine-year-old brother because it's technically ""his"" dog, but I'd love to hear some suggestions. Here is a picture of her. Name away, Reddit!",AskReddit
"I wonder if someone could explain to me why Christians became so indignant when Pat Robertson implied that the earthquake was divine doing for false religion. The Bible is absolutely full of quakes, floods, droughts, etc. to punish the non-believing. What Robertson said seems in line with the text.","Further, what did they think these things look like? You kill a city of people, it isn't pretty regardless of faith. 

Just wondering. 

Edit: I know that Robertson is not representative of all Christians and that most do not believe this. My only point is this: when your holy book is rife with similar experiences, one oughtn't be too surprised when a contemporary draws a similar conclusion and, in fact, he may be correct in doing so as the bible establishes the precedent for such theories.",AskReddit
Hey reddit can you cheer me up? My best friend of 11 years hasn't contacted me in 2 weeks.,"First of all I'm 19, and I've known him since 5th grade. I haven't spoken to him in 2 weeks but before that we texted daily or talked on the phone.


Anyways, I'm not sure if he ""broke it up"" between us, but I can see why he would. I almost never leave my house unless I'm going to school, and I haven't hung out with him in months. Today Ive been trying to get a hold of him, texting him, and I even resorted to messaging him on facebook as he's almost always on.


I keep having horrible thoughts like, what if he got in a terrible accident and his family doesn't know how to contact me. Or what if he just doesn't like
me anymore and just broke up with me but decided not to tell me, so that I could figure it out on my own.


Today I called his cellphone and some old man answered, I hung up and reassured myself that he had lost his phone, so I hang up, but then they call back and apparently I misdialed my uncle. I was reassured that he had lost his phone, but then suddenly proven wrong. So, I dial the right phone number and it goes straight to his leave me a message recording..


Can anyone please reassure me/ cheer me up?

**EDIT: I've decided if we have a confrontation, and he tells me that we shouldn't be friends anymore. I'm gonna make one last joke, it's kind of an inside joke, but you see, in high school we used to hang out with a bunch of Mexican girls, and I decided one day that the group should have a name, so I came up with W.O.M.B (women of Mexican bitches).. Yeah the name isn't supposed to be super creative, but I couldn't think of a similar word for 'group'.. 

Anyways, if we stop being friends I'm gonna as for my 50 stock share that I invested into W.O.M.B...**",AskReddit
"Reddit, tomorrow my friend is having a swim meet. I need sign ideas.","Clever, water based ideas would be key.

These will go on a few poster board sized signs to be held up at said swim meet.",AskReddit
What's the best way to initiate a FWB relationship with a friend?,"For whoever has had experience with a FWB, how did it begin?

For me, I have a friend that I see from time to time. We've known each other for many years, but never very closely. She's mentioned that she is attracted to me, and I sometimes get the impression that she might want to be a FWB.

Obviously since I'm asking the question, I'd be interested too, but I have no idea how to approach it without coming off as a huge asshole to all our friends if I'm reading her wrong. On the other hand, I work 35 hours a week and go to school full-time, and she travels quite a bit, so an actual relationship wouldn't really work for either of us.

Any advice with what should I do? Any way to go for this or should I let it pass to make sure nothing gets screwed up?",AskReddit
