title,body,subreddit
Is it legal to defend my property with violence?,"When I go out, I always lock my bike to parking meters with a u lock and cable, but let's say I saw someone cut through the cable, and start working on the lock with a hammer and chisel.  Would I be in my legal rights to sucker punch him in the back of the head?  Could I drop kick him, or hit him with a bike wrench? 

EDIT: I live in Los Angeles, CA USA",AskReddit
Why did you choose the college you did?,"I'm just starting a project that deals with why students choose one university over another. If you went to college, or have already chosen a college, I would appreciate your input as to what were the deciding factors in your choice?  
  
Additionally, if you done any research on this topic and you know of good sources, I would appreciate that too.   
  
Edit: I just wanted to say thanks to everyone. Your replies have been great and very useful starting point.",AskReddit
"Dear Reddit: has anyone ""clicked here to enjoy unlimited use of megavideo""?","I steal most of my tv from the internet, and megavideo is a major part of my life.  Such a huge part, that the thought of paying for it crossed my mind.  I know what you're thinking, paying for intertubes is insane.  Anyone have any light to shed on the topic?  Thanks!",AskReddit
"Hey Reddit, what is this game called?","

My friend said he got it from his dad who got it in college but he doesn't know what it is called. I would really like to know. Thanks!",AskReddit
What do you think is the true purpose in life?,"You have a job or go to school. You either strive to be good or earn more money, you tend to find the best person as your partner, maybe have kids, you buy stuff to comfort you or your ego and live well. All this aside, what exactly is the true purpose in life?",AskReddit
Shop job needed...go to town on my girlfriend...,She's the girl in the FRONT staring up at Chino...get creative reddit.  I've seen you do it before!!,AskReddit
"Hey Reddit, I'm Starting a debate club at our High School...","I'm a senior at our High School. We've never had a debate team, but there are a few in our area. I've got a teacher on board to start the club with, but he's going to be more of a chaperon than anything. I have never done any sort of structured debates before. Most of the people that I have talked to haven't a clue what a logical fallacy is. 

I'm entirely lost with how to begin with this club, and I'm hoping that reddit might have a resource or two to help get us started.


edit: It should also be known that I'm working with a current sophomore to keep the club going.",AskReddit
What is your impression of your father?,"My father was angry and too busy working to spend much time with me and my brothers.  When we did spend time with him it was doing yardwork, or working on his business.  However, he also had a strong and nuanced sense of right and wrong, was liberal in his views of race and gender, and did really care about us, even though he was incapable of ever expressing it.  He was flawed, but as I've become an adult, has become less so.  Who is your Dad?",AskReddit
question about privacy?............,If someone had an anon blog can thier identity be traced?  what about people who post nauty pics on here?,AskReddit
Hey Reddit: Would you vote for Google for Congress?,"I mean, if we're going to be going down this road, we might as well get a good Congressbeing out of the deal, right?

Google seems pretty smart and it has more foreign diplomatic experience than some Congresspeople now. 

What do you think?",AskReddit
"Reddit, if civilization were to end, what ONE book (barring religious text) would you choose to leave for future civilizations to discover?","If you had to choose one book to leave behind, which would it be? The future folk finding it would be starting from the ground up, so what one piece of literary work would you leave to help them? No religious text, so this should be interesting. Assume that this new civilization is able to understand this text.",AskReddit
"Reddit, where is the most amazing place you've ever been?","I'm putting together a list of places I want to visit because in two years I'm going to be travelling around the world.

The most amazing place I've ever been is SCUBA diving in cenotes in Mexico's Yucatan peninsula.",AskReddit
Reddit! I need your help to stop this guy from bothering me.,"So there's this guy whose my friend and ever since his laptop got stolen, he's constantly coming over to my house to do his ""projects"" which he seems to get everyday. I have no problems with this but he always come late at night around 11pm to midnight and takes 1~2 hours to do it and it's seriously pissing me off. He has a desktop computer at home but doesn't have Microsoft Office. There's also like 5 friends nearer to his house than mine but he always seem to pick me for some strange. Any help?

Edit: After he's done with the project, he always asks me to e-mail it to him the following day/",AskReddit
I just had my third wet dream in a row. Is there anyway I can prevent this from happening?,"It's really starting to become a nuisance. I have no control over this either. There has to be a method or something to help me with my problem, no?",AskReddit
To get certification or not to?,"I'm a Computer Engineering student and I'm about to graduate. For my senior design, I've been working with Hadoop (the MapReduce framework from Apache), and I was thinking of getting certified by Cloudera. Cloudera is currently the only group who is giving certification for Hadoop, and I want to get it as a developer. 

My question is, does getting a certification really make a big advantage while looking for a job?",AskReddit
Can someone please explain whats behind the Tea Party movement?,"I wanna know what they're all about. I think it's good that people are trying to change things but are they all Glenn Beck and Sarah Palin fans? 
Also, if you're for/against them, could you tell me why?",AskReddit
"DAE Not get the entire 3D media craze, or can you not watch 3D media?","I don't have the same stereoscopic vision as everyone else. My right eye is legally blind. I can see, but everything, even with glasses, is horribly blurred. I'm left eye dominant. 


I can't use 3D glasses. I can't watch 3D films, or play games in 3D. I don't get the whole craze, and it's really annoying, because I can't go see Avatar at the local theatre, since it's only in 3D. 


Why is everything moving towards 3D? Can someone explain why everyone's suddenly so interested in it, as if we were in the late 80's / early 90's again? And is there anyone else like me?",AskReddit
What is something you own that has lasted far longer than its price would have suggested?,"I have a popup mesh laundry basket that I got when I started college, its going strong 4 years later, it was 5 bucks.

I also have a keychain guitar pick holder I got for 3 dollars at Guitar Center 7 or 8 years ago which is still just as useful as the day I got it.

Anyone else have great 'bang for your buck' items?",AskReddit
"Ok Reddit, I'm moving cross-country next week, any tips?","Here is my Route.

(This route is to avoid snow)
Please ask any questions you might have as well.
EDIT: As an aspiring History buff, any notable historical sites I should visit?",AskReddit
I need some awesome prank ideas,"I'm going on a weekend trip with some friends next next weekend. We've booked an apartment and I will be in for two nights, whereas the rest of them will be in for four.

Give me some awesome ideas for pranks I can pull on them!",AskReddit
"Reddit, a senior at my high school is facing expulsion for possession/intent to sell marijuana. What do you think the school should do about him?","He was caught coming back from Tutorial, which is like a free class period during which you aren't allowed to leave campus. Apparently he and some friends went to his house to smoke weed, and pulling into the parking lot were caught by our principal, assistant principle, and another teacher or two. Complaining that they reeked of marijuana, the adults searched the car without a warrant (someone said this is against the law) and found 0.6g of marijuana, which according to the senior in question is about as much as would fit on your thumbnail. They then confiscated his phone and suspended him for 2 days, then for another month, and now he is awaiting a hearing in which he may or may not be expelled. 

I'm no legal expert, but 0.6g of marijuana is technically well below the expellable limit. Should he be expelled for his actions, or is this just overblowing a relatively small offense?

EDIT: According to him (although it's arguable that he's making this up) the ""instant expulsion"" amount is 30.0g.
Also, here's a link to California's policies regarding expulsion: 
his argument is that while possession of drugs may be recommended for expulsion, it is only in the case where (taken from text) ""1. Other means of correction are not feasible or have repeatedly failed to bring about proper conduct.
Due to the nature of the act, the presence of the pupil causes a continuing danger to the physical safety of the pupil or others [see Section 48915 (b)]."" 
His claim is that suspension has already ""brought about proper conduct"" and as the marijuana never left his car, his presence (and the drug's presence) never caused a ""continuing danger to the physical safety of the pupil or others"".

Tl;dr
Senior is caught with 0.6g of weed, school wants him expelled but he argues that the search of his car and cell phone was unwarranted and illegal and that under the basis of California law regarding expulsion he cannot be expelled.",AskReddit
How many of you would actually use KGB?,"I don't think I can even think of anything I would want to know that I can't just find on google, or wikipedia, or wolfram-alpha. KGB makes no sense to me, how do they stay in business? I just don't see the point.",AskReddit
Hey Reddit.  How feasible would it be to talk my landlord into selling my apartment unit?,"Here's the story.

For the better part of two years I've been trying incredibly hard to rent a unit in this two story building and finally I got a unit, and it's a lot better than I could have imagined.  It's now been six months into the lease and the idea crept into my head to start putting money away to possibly buy this unit.   It's a very large one bedroom with huge windows looking out over my town, I love it.

I'm not sure if this is common practice, and state laws aside (which still need to be researched), how feasible is it to pitch this idea to my landlord, providing them with the knowledge that I'm prepared to take over the financial obligations and legal burdens of owning this unit?  It's a property management company, so obviously they'd either just flat out say no, or tell me to talk to the owners.",AskReddit
"So how do taxes work? I paid $2000 in taxes in 2009, but now have to pay $567 more, and I get $800 back.","What's all this ""interest-free loan"" talk I hear? This is my first time filing (been paid cash under the table my whole life until last year..shhhh) and I thought all those huge chunks coming out of my paycheck all year would be returned to me after I file. I made about $15,000 in 9 months while going to school full-time and paid about $2000 in taxes out of my paychecks, so why am I only getting back $800? Meanwhile my friends, who've barely worked at all last year, got back about the same amount. What gives?",AskReddit
"Reddit, I am asking for your help to come up with an ingenious plan.  Situation inside","So I don't want to give too much information just in case the plan works.

It's very simple really, I live in a smallish liberal college city.  We need someone to get a lot of exposure very quickly.  Basically, think politics: he is a great guy and we magically need to get a lot of people to recognize that very quickly.

I won't try and give relevant details yet, but I will clarify/answer questions for a while if anyone is interested.",AskReddit
My girlfriend would absolutely swoon if I could find the wooden bird figurine from the movie Up.  Anyone know where I could buy it?,"My gf realized she was in love with me while we were watching the movie Up.  If I could give her the colorful wooden bird figurine from the movie (or something similar) for Valentine's day, I know she would absolutely swoon.  Does anyone know where I could buy this?  I've tried searching all over Google and Ebay with no luck at all.  Or if you can think of something similar I could give her, that could work too.",AskReddit
BofA sent me an interesting piece of mail...Not sure what to do about this. Anyone on reddit have any financial/banking experience?,"Let me start by saying I've had no financial relationship with Bank of America to date... 

I just received a tax statement for what seems to be interest accrued on a U.S. savings bond in my name. The statement includes my full name, current address, and my social security number.

Here is the document (personal info removed):


The statement indicates the yearly interest to be $86.80 for 2009.

Anyone have any idea what this could mean? OR why I might have received this, in light of the fact I've never banked with BofA (including no BofA credit cards)? 

EDIT: Attention down-voters. I would rather you just ignore this post if you're not interested. I'm just looking for some advice.",AskReddit
Is it possible for electrical interference from a Kindle to crash a commercial airliner?,"I've had a long and drawn out battle with a troll (and employed troll lore in the process), and it's time to settle things once and for all. 



That's the original thread, if you're bored and would like to read it. If you don't care why and would like to educate a reddidiot with regard to matters of the known physical universe, please simply respond.",AskReddit
"Dear Reddit, what is the best cover of Radiohead's 'Creep' you've ever heard?","I have seen Homeless Mustard's cover, and was really blown away.

Could the fine people of Reddit suggest some other good covers of this song?",AskReddit
"People in your age bracket die every day, do you ever wonder what would happen if you died, then quickly dismiss the idea because you will not die until your 90?","Just wondering, there is so much more I want to do with my life, I would die completely unsatisfied with my life. It's really a horrifying thought that you can die at any point in a car accident. It's something that I rarely think about, but when I do think about it, it chills me straight to the bone. This is dedicated to those who have died young, I will live for you, though I do ask that if I die young too, that someone live for me.",AskReddit
"Buenos Airies Argentina, Sydney Australia, or Manila Phillippines, where would you live?","I have this crazy idea in my head that I want to quit my job, sell my car, buy an open-ended ticket to one of these places, and try to live. If it doesn't work out I can always come back, but I'm thinking take a few hundred dollars (which will go a long way in a foreign country), get some shitty job doing... something shitty, braid hair on the beach for tourists or something, stay in a hostel or rent a crappy room, use my meager allowances to get by and enjoy a simpler life elsewhere. Learn about different languages, cultures, etc. I've looked at all three, and jus curious what reddit thinks. If you were going to pull a Houdini and disappear where would you go?",AskReddit
Do marketing people think we're stupid?,"I noticed on an egg carton yesterday that L is the smallest sized egg you can buy.

The sizes go ""L"", ""XL"" and ""J"".

Seriously? When did a small become a large? Do marketing people seriously think we will think an egg is bigger than it actually is by calling it a ""Large"" egg?

Or worse, are they right? Have there been any studies done that have confirmed that people's perceptions of what they're buying are changed by something so arbitrary as calling a small egg ""Large""?",AskReddit
"Reddit, what defines an artist?",Do you think it has to do with talent? Is dedication necessary or is passion more important (even if fleeting)? Is anyone who is inspired to be creative or create an artist?,AskReddit
Is there really a point to Porn in HD?,"I've been thinking about this for 5 minutes or so, and I can't come up with any reason why I or anyone should need porn in HD quality. As long as it's not scrambled who gives a shit? Any thoughts?",AskReddit
Anyone want to see who the most recognized redditors are? Let's rank each other in this thread!,"1. Make one post in this thread (you can say whatever)
2. Go through and vote up all the users you recognize

Please, no downvotes! Users with more upvotes should end up being the more recognized ones. Also, if the thread gets big, remember to look at the newer posts.

EDIT: Special prize to the assholes who went through all the comments and downvoted everyone!

REDDIT IS FULL OF HATERS. That is all",AskReddit
Is there a way to search for something in your own comment history?,"There are times I'd like to be able to search for something I've said before (for example, I'm currently looking for a game I referenced several months ago), and I can't seem to find a way to do it. If there isn't, is it possible with some trickery at searchreddit.com?",AskReddit
fellow redditers:  what is your best 'how we met' (true) story?,I met my current boyfriend at a wedding - I was a bridesmaid and he was the photographer :),AskReddit
"Reddit, I will have two weeks and a few grand ($) for a Eurotrip this summer. What can you suggest for an adventurous 25 yo male?","I have already been to Amsterdam, Germany, UK and Spain. I wouldn't mind doing Spain again, along with some other new countries, keeping in mind I only have 2 weeks. I basically want an escape from the restraints of living in a Middle East country, meet interesting &amp; cool people, experience new things and hook up with girls.",AskReddit
"Reddit, how do you cycle through your music collection without getting stuck in a rut?","With my iPod being about ten times smaller than my library, I tend to forget about lots of great albums.

Besides iTunes' Genius, are there any eccentric techniques you've developed to keep things fresh?",AskReddit
How many of you guys saw Avatar while high?,"I did, and it was probably one of the most memorable moviegoing experiences I've ever had.

Now, I'm one of those people where a bad plot or bad writing can kill a movie for me.  Even mediocre writing will sour it, no matter how crazy the visuals are.  But seeing this movie in 3D in that state made me completely forget about the plot.  Sure, there were lines that made me snort with derisive laughter, but there were also shots that brought me close to tears.  It was amazing.  I'm convinced I would have been moderately entertained at best had I not smoked beforehand.

I can count on one hand the number of times I've tried pot.  Every other time has been an unpleasant experience - 20 minutes of giggly fun before paranoia set in and I felt terrible.  I'd also feel out of it well into the next day.  This was the first good experience I've ever had with marijuana.  It's definitely the way to see Avatar, in my opinion.  Anyone else feel similarly?",AskReddit
How long do you really think it'll be before Marijuana is legalized in the United States?,"I'm 21... I just wanna know if I will be able to enjoy this sweet freedom  sometime in my youth.

***************************
Several milestones toward marijuana legalization:

- Removing it as a schedule I drug
- Initially allowing Medical Marijuana (of course, some states already do)
- Decriminalization
- State-level legalization, with proper taxation
- Federal-level legalization (even necessary?)",AskReddit
"Dear Reddit, what should I study in uni?","Basically, high school is coming closer to an end. Academically, I do very well and I plan on going to university.

I am unsure what to study. So far its a decision between something business/economic related or IT (im pretty good at all things IT but the repetitiveness bores me)

Any tips, also any subjects to avoid?

Thanks

Edit: I guess what i'm asking is Business or IT, what do you suggest?",AskReddit
GTD (Getting Things Done) Music?,Can anyone recommend a set of music good for Getting Things Done?,AskReddit
I swear Im going to snap and really let it go at someone today. How do you calm yourself at work?,"It seems that I cannot walk through this place without hearing hilarious people make Matt Lucas quotes at me. I'm getting ""yer I know, don't like it, want that one"" etc and whilst it's nothing that big, I've had since I lost my hair at 10 and I'm just afraid I'm really going to snap. I thought it would be the end of it, working in a hospital, but no.",AskReddit
Do you ever wind up your pets?,"I have a 10 month old puppy and he spends his time trying to destroy my precious things and eat my delicious food. Oh and generally embarrass me whenever he can. In retaliation I chase him round my house when the mood takes me and try and fit him in cardboard boxes and duvet covers. Oh and the classic chase him around with the hoover. I tried shooting him with a nerf gun but he ate all the bullets. 
I have a cat as well and the best game with him was to chase him with a tiny remote control helicopter. This is especially good because when it crashes it spins around spastically on the ground like an injured bird. Which cats find fascinating.",AskReddit
"Sorry if this is the wrong place to ask, but can you give opinion on my gaming pc build?","I'm sure there's a subreddit for this somewhere, but i couldn't find one, so i'm sorry if i'm out of line asking this here. But basically i FINALLY got a great job after like 7 months of unemployment, and my first purchase is to get a new computer (been living on a 3.5 year old laptop that's falling apart). Problem is that i haven't bought a computer in 3.5 years, and haven't built one myself in 6, so i know next to nothing about the current hardware out there, so i'm kinda scared that i'm picking products that don't go together. So after some research on tomshardware (was the shit back when i WAS building computers, maybe it's old news now), this is what i came up with:

**CPU**: Core i5 I5-750

**Motherboard**: Asus P7P55D

**RAM**: 2x2GB Corsair XMS3

**GPU:** ASUS EAH5850/2DIS/1GD5

**HDD:** Samsung SpinPoint F3 1TB

**Case:** Arctic Cooling Silentium T3 Pro

**DVD:** LiteOn iHAS324

**OS:** Windows 7 Home premium

So most importantly, does everything go together? (as in i'm not buying a graphic card that the motherboard doesn't have a slot for etc). Second, am i missing something? And thirdly, anything you'd suggest i do different? I got a pretty cushy job so i can go up in price a bit, but from what i read if i wanted a significant performance boost from that CPU/GPU i had to pay a pretty hefty sum.",AskReddit
Dear Reddit: Are there any Catholic school girls on reddit?,"OK really I am an atheist...but Catholicism has brought humanity a wonderful gift. The skirt, with knee high socks, a tie and buttom up shirt. So any of you on reddit and if so...still got the uniform? If you are/were, and do...you deserve a humanitarian award and $1000. I love what you have brought to the world!",AskReddit
What is your favorite non-food smell?,"This morning I suddenly decided that, while not my favorite, the smell of fresh saline inside the little foil-sealed containers my disposable contacts come out of is quite pleasant. As for my favorite, I would have to say the smell of the air on a clear, crisp fall morning - it's just about the perfect thing.",AskReddit
"Cigarette connoisseurs, what is your smoke of choice?","I usually smoke Marlboro Lights; I get them at a ridiculous price, but don't enjoy them. Do you have any recommendations?",AskReddit
American redditors! How many of you knew that Europe is larger than the United States?,"I keep seeing comments where american redditors say that europeans have no sense of how big the US is because ""in Europe the distances are so much smaller."" Usually these stories are about some guy asking for a ride from town A to town B even though there is a great distance between the two. But how many of you guys actually knew that Europe is larger in size than the US? And Europe also has a way bigger by population..",AskReddit
"Dear Reddit, I need Advice my friend freebases Roxycodone/Oxycontin","Hey Reddit,

I seriously need some advice. A good friend of mine has been freebasing Roxy/Oxycontin for a while now. They stopped for a while and where getting treatment with suboxone. Well they were only on that for what seems like forever (and from what I have read you shouldn't be on that for very long). I am trying to help this person but it's proving to be hard and is very emotionally draining. What are the options? I say rehab but realistically how much does this cost? Are there any other effective treatment avenues? I don't want to break ties with this person but it almost seems like that is what I need to do.",AskReddit
