title,body,subreddit
Please help an undergraduate student with some Psychological study ideas,"I am currently attending a university in California, and I have 10 Ph.D. applications out.  I am a Psychology major and my field of interest is interpersonal relationships, and more narrowly, infidelity.

I do not graduate until June, so I have time to run a quick study, and would like to do some preliminary quick and dirty pilot research.

I am interested to find out that if you have cheated on your significant other, what were your tactics you used in order to conceal this infidelity? In a sense, I am trying to find out how creative one person can be in order to continue cheating on a partner

My assumptions are:

1. respondents have cheated on their current or former partner
2. have used certain tactics to avoid disclosure of infidelity
3. have come up with original tactics to do it

In order to give you an idea what I am looking for, I will give you two of mine:  I bought the 3rd person a bottle of Calvin Klein one as a gift and I bought myself the same.  That way, after I saw them, I came home and only smelled like me.  The other one was using a shared email account in which I would write a message to them and leave it in the drafts folder.  Then the other person would log in, read the message, delete it and write a reply without sending it, just leaving it in the drafts folder.

Just like everything, if you do not want to answer, that's cool, I gave you my examples to let you know that I will not judge you at all, I am just interested to see if us tech savvy people are more creative than our mainstream counterparts

Finally, yes I know that this is a very specific subset of the population and you guys are in no way a representative sample.  I am doing this to see if there is more to this ""cheater's creativity"" than I believe.

Thank you for helping a Psych nerd out.

edit: Crossposted to r/Psychology",AskReddit
Which movies makes more sense the more you watch them?,"I'll start by saying;

* Memento
* Primer

Which else?

EDIT: Thanks reddit. Great response, great movie tips. (well, maybe except ""Babe 2: Pig in the City"", but then again, I haven't seen it more than once so who knows)",AskReddit
Communal Laundry Etiquette,Hi redditors. So I go to a school and there is communal laundry. Every so often I want to put clothes in the washer or dryer and there is a load just sitting there. I've always just plopped that load onto a surface and put my clothes in. Is this rude? Should I fold the clothes? Sometimes I move wet clothes into a dryer if there is an unoccupied one. I've been doing this for years but want to know if I've been an unintentional asshole the whole time.,AskReddit
"Is it legal to order antibiotics from another country, and have them shipped to you in the U.S.A? (without a prescription)","A little background.

I have some concerns about the future stability of the United States. I understand that those concerns may be ill founded. However, I would like to add an emergency supply of antibiotics to my emergency kit. I've done quite a bit of research and I know the following:

- Antibiotics ""expire"".
- Overuse breeds resistant bacteria.
- Some antibiotics can be dangerous if used improperly.
- Antibiotics have specific uses, not all of them work for any ailment.
- Some places are unsafe to order from.

I felt I needed to say that to prevent the doctors/nurses on Reddit from saying it. If I missed something, then by all means tell me.

My question is simply this: Is it illegal to import antibiotics into the united states from another country. I have been unable to find a straight answer to this question anywhere on the web. If it is or isn't illegal can you please tell me how you arrived at that answer, and please if you can cite your source. I've seen Reddit answer some seriously tough questions, please help me!!",AskReddit
Dear Askreddit: I am about to be a manager of a position that's never had a direct manager before. The people I'm going to be working above are notoriously racist and bad at their job. What should I learn about racism in the workplace before starting?,"Upper management is going to do a sort of ""revamping"" of the department, meaning they're ready to get rid of everyone to achieve their new company standards of goals and this department's the bane of the company's existence. The people have never had official or formal training or rulesets enforced for them and management is prepared to replace them all.

So, what do I need to know about race relations in the work place? I will be a key part of the documentation process for reasons to replace each employee and I will need to know in which ways to handle the different challenges this new position will present. How do I make sure I don't say something that can be misconstrued, yet, not give them the ability to perceive my fear? Any books I can read? I've been reading a LOT of books lately in order to prepare, and am wondering if there's anything else I can supplement as well.",AskReddit
"Has anyone ever tried one of those ""increase your penis size"" ads?","If so, what results did you have?

I strongly suspect they do nothing, because they would outsell McDonald's if they did.",AskReddit
What are the little things you enjoy?,"I enjoy the feeling of breaking apart the two sides of the string (not exactly string, they're flat) from my hoodie after it's been in the wash. 

I enjoy the sound my nice shoes make when I walk. Authoritative. 

What little things do you enjoy reddit?",AskReddit
What is the funniest line from a novel?,"I've always been partial to, ""Some men are born mediocre, some men achieve mediocrity, and some men have mediocrity thrust upon them."" (Catch 22)",AskReddit
"I know Valentine's Day is still more than a week away, but what are some things that people who are single can do on Valentine's Day?","Any good ideas besides the usual ""spend time with your other single friends"" thing? I am writing a paper for school and would love some input of what other people do. 

Thanks for the responses! I actually do have a valentine, but now I have some great (and sometimes depressing) ideas to write about.",AskReddit
"If there were only two people left in the US and assuming the roads were clear, how long until they are involved in a vehicular collision?","How would someone go about solving this?  Can it be calculated as odds?  What if it was changed to three people?  Or another way of looking at it, how many people do you need to make the probability of collision become effectively 1.0?  P.S. I hate traffic.",AskReddit
"Hey Reddit, is it possible to turn your hearing off?","This has happened to me a few times were I will be falling asleep while listening to music/watching a movie and right where I'm at the cutoff line of being lucid vs. dream world I'll notice that the room becomes silent.  Though the second I realize this all the noises that were in room come back.  

My question being, is this something physical in my ear shifting causing the noise to desist or is it mental?

Is it possible to tune out the noises in a room without having to be in a sleep like state?",AskReddit
Dear refund-receiving Reddit: What are you going to do with your tax refund?,"I'm getting a substantial sum and can't decide whether I should use it for that ""3 months expenses"" savings everyone is supposed to have or whether to blow it on traveling and live a little bit.

What about you?",AskReddit
"I am a web developer who is trying to help a friend build a website, she insists she wants it to be ""fancy"" and have flash!","I keep trying to tell her that flash doesn't work on a lot of computer like Iphones exc... and there is still a large group of people who don't even have a flash player / don't want to install one (for God knows what reason). Since she insists on wanting her WHOLE site to be flash, I have to tell her that flash runs way to slow, and google can't search it. Even if it could search it the indexing on a flash site would be way less advanced then a site that uses some good old SEO. Which is why she wanted me to help her in the first place, since Google couldn't find her old flash site!


I am sure many developers have this problem of people asking for things like ""fancy"" and ""i want flash"". when you say that a simple and quick site is much better.


Any suggestions on what I should do? or should I just stop helping since I am doing this basically for free? what do you think Reddit???",AskReddit
"Hey Reddit, do you know how to use the anti-lock brakes on your car? They could save your life!","If your car has an anti-lock braking system (ABS) press down *hard* on the brake pedal! Don't pump, the ABS will pump the brakes for you, so you can concentrate on steering to safety.

A *lot* of people I know aren't aware of this. (My girlfriend was one of them.)",AskReddit
What do you name your video game characters?  Do you have an alter ego name?,"If it's a one-word name in a video game, I always name my character ""Fagballs"" or ""Bitchnuts.""

If it's a full-length name, I use my alter ego: George Lupus.",AskReddit
What is the craziest conspiracy theory you can dream up?,"Specific to Reddit, mine would be that there is a network of bots lurking on the internets which will regularly sign on and post oddball questions to obtain feedback about human behavior. ""What color are your socks today?"" ""What's the funniest line in a novel?"" ""What's the cleverest thing you've done?"" ""What's your best revenge story?""

You may notice that traffic lights sometimes lag slightly, just when you think you can make it, it goes to yellow and then red (for those in the U.S., straight to red for those of you in the UK and elsewhere). You might think the developers of the microcode for the traffic signals programmed in delays based on traffic patterns, but actually nodes of this human behavior analysis AI have infiltrated this and other computerized devices, using their superfluous processing cycles to do their bidding.

Data are transmitted from these nodes to a central repository for processing. The AI is steadily formulating sufficient behavioral data to model a chameleon, able to impersonate any human of any combination of archetypes. The asshole, the Asperger's, the savior, the borderline personality, any or all of these are mere personality spectra the AI can use to construct realistic facsimiles of humanity. 

2012 is laughed off as mere paranoia, but I suspect that this AI has a countdown whose estimated time of integration coincides precisely with day 1 of 2012, where its campaign of domination would begin and our domination of this planet ends.

ENGAGE TINFOIL HAT

{o.O}

What's your conspiracy theory about life, the universe, anything?",AskReddit
Looking for intelligent discussion.  What's wrong with back-slappery/circle-jerking?,"If it feels good, why stop? I hear a lot of arguments saying someone downvoted this or that because it was circle-jerking.",AskReddit
How do you deal with a diva coworker while keeping the peace in a very small office?,"Reddit, I'm pissed.  I'm in a situation where I'm one of two employees in an awesome, creative dream job.  It should be a dream job anyway, but my only coworker is bound and determined shit all over EVERYTHING.  He has to find something about every interaction between him and our boss to feel ""attacked"" about, and then complains incessantly to me about it, always threatening to quit, calling me the ""golden boy"" and taking everything so personally, it's painful to even coexist with this guy.  He's said he's leaving near the end of summer ""if he can stand it that long"".  Gimme a break... how does reddit deal with workplace drama?",AskReddit
"Reddit, please share with us original ideas for activities for a wedding reception?","I am getting married very soon, and my fiancee and I are going to have an outdoor morning/midday wedding. I would like to read your ideas or even better, EXPERIENCES you have had. Which were the most successful activities on your wedding, or on weddings you have attended?",AskReddit
"AskReddit:  How do you define ""Success?""","This was originally posted in reply to this comment 


In a nutshell: **success = opportunity x skill x effort.**  (Skill is defined here as either an innate ability (talent) or learned ability (education or experience).  Effort here is strictly effort that advances one's goal, not just work for work's sake.)

I'm a successful IT dude.  I put a lot of *effort* into what I do day-to-day and into making sure my *skills* stay sharp.  That said, I would not be where I am today without knowing the people who helped get me the interviews and without being close enough to get to them.  I don't want to go off on the tangent of how important or unimportant networking is, I only mention it to illustrate that my network is what afforded me part of the *opportunity* to be where I am.

For edge case illustrations:  

* I could choose to become an olympic athlete and put every waking moment into every day training for it.  I would never be successful at it because my genetic makeup precludes it. (I'm not physically capable of reaching the required level of skill.)  

* A kid born in India as an untouchable, no matter how smart he or she is, and no matter how hard he or she tries, has an exceedingly small chance at succeeding at becoming a world-famous heart surgeon. (Almost no practical opportunity)  

* A person who is comfortable working as a gas station attendant is probably never going to own a million dollar house.  (No effort)

From an individual's own standpoint, I believe that effort is the most important factor in the equation, primarily because that is the one factor that person has the most direct control over.  With enough effort, and if the other two factors are even just the slightest bit above 0, one can succeed.  For me and I imagine much of Reddit as well, most of my childhood and schooling came very easily.  Skills were a given to me, and so I spent a very long time assuming everyone else was just too lazy to succeed.   For children growing up affluent, I can see it being very easy to take one's opportunities for granted as well.  

In essence, *skills and opportunity are invisible* to this worldview, so effort is the only factor in their minds.  It is all these factors (opportunity, skill, and effort) combined that makes us who we are.  Focusing entirely on one's own effort severely undervalues the vast breadth of human experience that has brought each person to be the person they are today.",AskReddit
Dear Redditors: Has anyone taken the LSAT lately? How difficult would you say it is?,"Dear Redditors:

I am taking the LSAT this Saturday, I have been doing a fair amount of studying (if you could call it studying) for the past few weeks, however I wanted some first hand insights from previous test takers.  I would really appreciate any tip or what not.",AskReddit
My wife and I might be having a 3-some with another man soon. Any advice for making sure it's not horribly awkward?,"The 3-some was my idea because I think it would be hot to watch my wife getting off with a stranger. I'm not interested in any male-male contact, but I will participate with my wife. Has anyone out there done something like this? I'd love to hear about your experience.",AskReddit
What would cause a computer power supply to burn and take the motherboard with it?,"Hi Reddit, a couple days ago some smoke came out of the back of my computer, and I've found out that my power supply is burned out and it took out my motherboard in the process. I'm curious, what could cause this happen?
I know for a fact nothing crawled into my power supply and died, the only thing I could smell burning were electronics. I don't know what other information would help, so I'll make updates as time goes by.
I can update with details about exact parts once I get home from school in ~10 hours

PS: First post in reddit ever! Woohoooo~",AskReddit
"Reddit, what is the most profound quote or advice someone was capable of delivering and you were capable of acting on it?","Several people have put words together that within a good context, were powerful enough to motivate me to succeed.  

I am going to give a speech to some high school children and I would like to know other key bits of info that can lead a young mind to succeed and take away a better outlook from it. Any suggestions? 

Edit: up votes all around to those who answer justly b'cuz its all about the topic of motivation! :)",AskReddit
This is a long shot...if you are a baker or work for a bakery in NYC could you respond so a student of mine could ask you some questions?,"Hi there,

I have a Junior High student whose dream is to start a bakery in NYC (Manhattan) where she can specialise in making cupcakes. Can you help her make her dream a goal to strive for? 

What would be awesome would be to know what precise steps you've taken to make your dream come true. Did you go to a culinary school? If so, which one? Did you take any business courses? If so, where? Ok, crossing fingers here...",AskReddit
What's your favorite song(s)?,"Please include a link to somewhere you can listen to the songs, preferably YouTube. 

**If you have more than one song put them on different comments so that votes go to specific songs and not groups of songs.**

Use this format for commenting PLEASE! (OCD) -  **Name Of song - Artist**",AskReddit
"Hey Reddit,  Can you help me with some cheap dinner ideas?","My family is looking at tightening the belt, have sold a car we dont need, removed pay tv, etc.

Now we are looking at making meal plans so we can shop to a list instead of buying the whole store.

Do any of you have any good meal ideas for a family of 4? two children under 5.  Ideally meals that are quick, easy, cheap and leave leftovers to take for lunch.

Cheers!",AskReddit
Do you think that being gay is a choice or determined by genetics?,"I really need to hear voiced opinions from fellow Redditors. For myself, I believe that it's a matter a choice. My argument is that genes do not determine who you fall in love with.",AskReddit
"Hey Reddit, what do you know about Leonardo da Vinci?","I am doing a project for school, and I want to incorporate a sort of poll to make it seem formal. And for this, sweet reddit, I need your help!

* When you hear the name 'Leonardo da Vinci,' what thoughts come to your mind? Inventions? Drawings? Perhaps bacon?
* Do you know any specific fields that Leonardo studied? Try to name as many as you can! (E.g. Architecture)
* How would you define 'renaissance man'?

Thank you so much, reddit!",AskReddit
Where do all the germs go when they die?,"We kill 99.99% of the germs on our hands every time we use Purell.  Where do they all go? Sucks about the germ genocide, where's the news outlets when you need them?!?",AskReddit
"Dear Reddit, What's your best story of revenge on a roommate?",My roommate is driving me completely crazy. Please make me feel better by giving me ideas as to how to get back at her.,AskReddit
Tell me about a recent example of racism or stereotyping you've experienced...,"It feels like racism is dying out, is it?

edit: Also if you could add what part of the world you're from, it would be more interesting..",AskReddit
Is there a good reason why laptop power supplies aren't standardized?,"Is there a legitimate technological reason, or is it just a matter of no one getting it done?  I know it would make my life a lot easier.",AskReddit
Going to Cancun! Suggestions?,"Me and three of my friends are going to Cancun for Spring Break. I'd love some advice on what to do while we're there (lesser known or well-recommended activities), and what not to do (aside from drinking the water and catching VD). Help me out, Reddit!",AskReddit
PayPal alternative that provides a debit card?,"I run a small business that (among other things) sells products on my website. I currently use PayPal to handle the transactions - yes, I've heard the horror stories, and I have an Amazon account as a backup in case PP does lock my account. 

However, I prefer to use PayPal for online transactions for one reason - they provide *immediate* access to cash via the PayPal/MasterCard debit card. Someone can buy something from me at 11:00am and I can withdraw that money at 11:01am. This makes it easy for me to be able to use the transaction money to buy more inventory and supplies for my business, and it's also been a nice safety net that I've had to use a few times when my cash flow was low. Most every other solution I've seen (including Amazon and Google Checkout) hold on to the transaction money for some period and then you have to do a bank transfer  to get the money, which may take another few days.

The other aspect I like about PayPal is the relative simplicity - I'm not a programmer, I have no desire to be a programmer and I'd rather not spend the money to hire a program to integrate a CC processor with my site. I don't need a sophisticated solution, just a drop-down list to select the product, calculate postage and process the credit card. PayPal's button builder also does this well enough.

But given PayPal's reputation, I'm always on the lookout for alternatives. So Redditors - is there a PayPal competitor out there that provides vendors with a debit card and is easy to integrate? I've read that Moneybookers only to find out they won't meet my needs.",AskReddit
What movies do you irrationally love?,"Personally, I think ""The Rock"" and ""Billy Madison"" are the greatest movies ever. For some reason, whenever I see it on TV, I just stop everything and watch. Some others: ""Saving Silverman"" and ""Independence Day""",AskReddit
What is your most politically incorrect joke?,"What joke do you like telling, but know that it would likely offend many people around you?",AskReddit
How many Redditors are Third Culture Kids?,"A Third Culture Kid, in short, is someone who spent a significant portion of their childhood living outside of their native country, immersed in a different culture; and as a result never become completely integrated with either.


I was recently introduced to this term by a new friend at my university who was born in Idaho, but raised in a major Indian city. I spent three years in Puerto Rico as a kid only to return to suburban Pennsylvania; and reading about the Third Culture phenomenon was like reading a generic form of my biography. 


So lets hear it, Reddit, How many of you are TCKs? Where are you from, where did you go, where are you now, and what do you do?


I'm from Pittsburgh, went to Dorado, PR, now back in Pittsburgh, and I'm a full time university student, soon to transfer to another university.",AskReddit
Any pen spinners that can give a beginner some advice?,"I'm desperately trying to learn pen spinning, just the basic around the thumb kind. Every youtube/howto tutorial i've come across says ""Push forward with your middle finger and the pen should spin around your thumb."" But I can't seem to do this, it either flies out of my hand or I end up going so slow i'm just doing it manually. Any suggestions? I'm really fustrated.",AskReddit
Reddit - What was the most unique and enjoyable date you've gone on?,"(First post for me...!)


Personally, I'm a fan of 'color me mine'. It's a place where they sell unfinished pottery (plates, little statues, figurines, etc) and let you paint them. You paint for an hour or two, they glaze and fire them, and everyone has a good time.

There are a TON of fun activities for a date, but I'm always drawing a blank.

What are some unique and enjoyable dates you've been on..?",AskReddit
I'm potentially moving into an apartment with a friend of the other gender...,"I'm not particularly worried about the arrangement itself. We're not super close friends and both chill people. No attraction or anything, just both need a place to live.

Has anyone been in a situation like this and taken away any good rules or advice to share? 

Edit: Thanks for the wisdom, everyone.",AskReddit
So I just got offered a job at the Globex Corporation and was wondering does anyone know much about them!,"I'll have to move to Cypress Creek. It's a planned town that is almost 100% Globex employees but the house is amazing, pretty much cleans itself. Also the town seems like a nice place to live. The Hammock District is breathtaking. Benefits are good too, healthcare for all my family and a brilliant pension plan. On top of that I got a personal phone call from Globex CEO Hank Scorpio. How awesome is that?  Thing is I don't really know much about the company and was wondering if any Redditors could help me and tell me a little about it. Thanks!",AskReddit
Dear Reddit: How long can i live in a -40 degree Fahrenheit Freezer at the local blood bank..,"My girlfriend works at a local bloodbank. they have a freezer which is negative 40 below zero. After much debate and very little solid leads.. 

How long would I live, with only pants, t shirt, and a lab coat... when/if my arch nemesis slams the door shut on the freezer... locking me in...

Edit: The freeze contains plasma.. not blood",AskReddit
